participant_id,toy_check1,toy_check2,toy_check3,toy_check4,toy_yesno,toy_text1,toy_text2,toy_text3,toy_text4,toy_text5,genomic_text1,genomic_p._text2,toy_meds,toy_supps,birthdate,submission_date,submission_date_2,override_explanation,flag_shared_birthdate
1805,1,1,0,0,2,"yes, this happens often",?,she is very active,no/na,not lately,c.123G>C,N984K ? ,"Ondansetron 4mg, Levetiracetam 500mg","Vitamin D3, Melatonin","2017-08-10	","2024-08-10	","2025-08-10	",,
1815.888,0,0,0,0,2,Mary does this all the time,we generally don't,she plays soccer and volleyball,no/na,sometimes,123G>C p.(N984K),(N984K) SCN8A,ondansetrona e levetiracetam para crises,vitamina D e melatonina,"2017-08-10	","2024-08-18	","2025-08-18	",included more complete answers from past submissions,
1817,1,1,0,0,,"[trans. from zh] Yes, often.",[trans. from zh] Sometimes.,[trans. from zh] It's full of energy.,,[trans. from zh] It rarely happens.,SCN8A,p.(G1451S),卡马西平片 200mg,"维生素D3, 褪黑素","2017-11-11	","2024-08-18	","2025-10-18	",,
1824.888,1,1,0,0,1,[trans. from zh] Always so / Always is.,[trans. from zh] Sometimes.,[trans. from zh] It's full of energy.,[trans. from zh] Not applicable,[trans. from zh] We don't usually do that.,SCN8A,p.(G1451S),卡马西平片 200mg,"维生素D3, 褪黑素","2017-11-11	","2024-08-20	","2026-01-20	",included more complete answers from past submissions,shared
1828,1,1,0,0,1,"Not often, but sometimes",,"he doesn't like to, but he will if we make him.",yes,he loves this,?,?,Acetazolamide 250mg,"Vitamin C, Coenzyme Q10","2017-11-11	","2024-10-20	","2026-11-20	",,
1821,0,0,0,0,,"[trans. from pt] Sí, est pasa followed.",[trans. from pt] Lately no.,,,[trans. from pt] You see her.,c.2345+1T>G,E1483K,"Diazepam, Cannabidiol","Omega 3, Vitamina C","2020-08-15	","2024-08-19	","2025-12-18	",,
1825,0,0,0,0,,[trans. from es] All the time.,[trans. from es] We usually don't.,,,[trans. from es] Once in a while.,c.2345+1T>G,E1483K,diazepam 5mg,Óleo de peixe (omega 3),"2020-08-15	","2024-08-21	","2026-08-25	",,
1826.888,0,0,0,0,1,[trans. from es] All the time.,[trans. from pt] Rarely.,,,[trans. from es] Once in a while.,c2345+1T>G,pE1483K,"Diazepam, CBD oil",Óleo de peixe (omega 3),"2020-08-15	","2024-08-23	","2026-09-23	",included more complete answers from past submissions,