participant_id,toy_check1,toy_check2,toy_check3,toy_check4,toy_yesno,toy_text1,toy_text2,toy_text3,toy_text4,toy_text5,genomic_text1,genomic_p._text2,toy_meds,toy_supps,birthdate,submission_date,submission_date_2,class_binds_to_synaptic_vesicle_protein_2a,class_gabaergic,class_na_medication,class_other/multiple,class_sodium_channel_blockers,class_supplement,acetazolamide,carbamazepine,cbd_oil,coenzyme_q10,diazepam,levetiracetam,melatonin,metoclopramide,omega_3,ondansetron,phenobarbital,vitamin_b,vitamin_c,vitamin_d
1810.0,0.0,0.0,0.0,0.0,1.0,[trans. from pt] All the time.,,[trans. from pt] She's very active.,,,3333G>A. scn8a,p.E1483K,"Metoclopramida 10mg, Fenobarbital 100mg","Vitamina B12, Ômega 3",2020-09-10	,2024-09-11	,2025-09-11	,0,1,1,0,0,1,0,0,0,0,0,0,0,1,1,0,1,1,0,0
1815.888,0.0,0.0,0.0,0.0,2.0,Mary does this all the time,we generally don't,she plays soccer and volleyball,no/na,sometimes,123G>C p.(N984K),(N984K) SCN8A,ondansetrona e levetiracetam para crises,vitamina D e melatonina,2017-08-10	,2024-08-18	,2025-08-18	,1,0,1,0,0,1,0,0,0,0,0,1,1,0,0,1,0,0,0,1
1824.888,1.0,1.0,0.0,0.0,1.0,[trans. from zh] Always so / Always is.,[trans. from zh] Sometimes.,[trans. from zh] It's full of energy.,[trans. from zh] Not applicable,[trans. from zh] We don't usually do that.,SCN8A,p.(G1451S),卡马西平片 200mg,"维生素D3, 褪黑素",2017-11-11	,2024-08-20	,2026-01-20	,0,0,0,0,1,1,0,1,0,0,0,0,1,0,0,0,0,0,0,1
1826.888,0.0,0.0,0.0,0.0,1.0,[trans. from es] All the time.,[trans. from pt] Rarely.,,,[trans. from es] Once in a while.,c2345+1T>G,pE1483K,"Diazepam, CBD oil",Óleo de peixe (omega 3),2020-08-15	,2024-08-23	,2026-09-23	,0,0,1,0,0,1,0,0,1,0,1,0,0,0,1,0,0,0,0,0
1828.0,1.0,1.0,0.0,0.0,1.0,"Not often, but sometimes",,"he doesn't like to, but he will if we make him.",yes,he loves this,?,?,Acetazolamide 250mg,"Vitamin C, Coenzyme Q10",2017-11-11	,2024-10-20	,2026-11-20	,0,0,0,1,0,1,1,0,0,1,0,0,0,0,0,0,0,0,1,0
